{
  "scanner_version": "0.1.0",
  "timestamp_utc": "2025-11-13T10:03:51Z",
  "os": {
    "platform": "Windows",
    "version": "10.0.26200"
  },
  "controls": [
    {
      "name": "firewalls",
      "status": "pass",
      "score": 1.0,
      "findings": [],
      "recommendations": [],
      "details": {
        "enabled": true,
        "profiles": [
          {
            "Name": "Domain",
            "Enabled": 1
          },
          {
            "Name": "Private",
            "Enabled": 1
          },
          {
            "Name": "Public",
            "Enabled": 1
          }
        ]
      }
    },
    {
      "name": "secure_configuration",
      "status": "pass",
      "score": 1.0,
      "findings": [],
      "recommendations": [],
      "details": {
        "guest": {
          "enabled": false,
          "raw": "User name                    Guest\nFull Name                    \nComment                      Built-in account for guest access to the computer/domain\nUser's comment               \nCountry/region code          000 (System Default)\nAccount active               No\nAccount expires              Never\n\nPassword last set            13-11-2025 15:33:49\nPassword expires             Never\nPassword changeable          13-11-2025 15:33:49\nPassword required            No\nUser may change password     No\n\nWorkstations allowed         All\nLogon script                 \nUser profile                 \nHome directory               \nLast logon                   11-09-2024 23:04:45\n\nLogon hours allowed          All\n\nLocal Group Memberships      *Guests               \nGlobal Group memberships     *None                 \nThe command completed successfully."
        },
        "rdp": {
          "enabled": false
        },
        "smb1": {
          "enabled": null
        }
      }
    },
    {
      "name": "access_control",
      "status": "pass",
      "score": 1.0,
      "findings": [],
      "recommendations": [],
      "details": {
        "local_admins": {
          "members": [
            "Administrator",
            "HP",
            "NT AUTHORITY\\LOCAL SERVICE"
          ],
          "count": 3
        },
        "password_policy": {
          "raw": "Force user logoff how long after time expires?:       Never\nMinimum password age (days):                          0\nMaximum password age (days):                          42\nMinimum password length:                              0\nLength of password history maintained:                None\nLockout threshold:                                    10\nLockout duration (minutes):                           10\nLockout observation window (minutes):                 10\nComputer role:                                        WORKSTATION\nThe command completed successfully.",
          "max_age": "(days):                          42",
          "min_age": "(days):                          0"
        }
      }
    },
    {
      "name": "malware_protection",
      "status": "pass",
      "score": 1.0,
      "findings": [],
      "recommendations": [],
      "details": {
        "windows_av": {
          "products": [
            {
              "displayName": "Windows Defender",
              "productState": 397568
            },
            {
              "displayName": "McAfee",
              "productState": 3424256
            }
          ]
        }
      }
    },
    {
      "name": "patch_management",
      "status": "unknown",
      "score": 0.7,
      "findings": [],
      "recommendations": [
        "Run as Administrator to read hotfix history"
      ],
      "details": {
        "latest_hotfix": {
          "latest_hotfix_days": null
        }
      }
    }
  ],
  "overall": {
    "status": "unknown",
    "score": 0.94
  }
}